{
  "id": "01j9z8y7x6w5v4t3s2r1q0p9na",
  "image": "ubuntu:24.04",
  "cpus": 1,
  "memory_mb": 1024,
  "disk_mb": 10240,
  "pids": 1024,
  "network": "allowlist",
  "allow_hosts": ["github.com", "*.githubusercontent.com"],
  "env": {"APP_ENV": "sandbox"},
  "expires_at": 1760644800,
  "repo": {"url": "https://github.com/acme/shop.git", "ref": "main", "token": "example-token"}
}
